sentence,keyword
"Which one of the following, if true, most helps to reconcile the belief of most economists with the consequences observed by most wine merchants?",['if']
Why should my youth alone prevent me from writing well about the music of a period as recent as the 1960s? Which one of the following most accurately represents what is at issue between Jorge and Ruth?,"['as', 'and']"
"Each of the following, if true, weakens the argument against the predominant theory about northern cave paintings EXCEPT:",['if']
Antonio and Marla disagree over,['and']
"On the basis of their statements, Logan and Mendez are committed to disagreeing over whether",['and']
The educator's conclusion follows logically if which one of the following is assumed?,['if']
"Which one of the following is most strongly supported by the statements above, if they are true?",['if']
"Each of the following, if true, supports the criminologist's claim EXCEPT:",['if']
The conclusion above logically follows from the premises if which one of the following is assumed?,['if']
"Which of the following, if true, most seriously weakens the claim that the prediction of a teacher shortage as early as next academic year is unfounded?","['if', 'as', 'next']"
The engineer's argument can most reasonably be interpreted as invoking which one of the following principles?,['as']
The reasoning in the employee's argument is flawed because the argument,['because']
The dialogue provides the most support for the claim that Albert and Yvonne disagree over whether,"['and', 'for']"
"Which one of the following, if true, most helps to explain the unusual health condition of the residents of Limone?",['if']
Which of the following provides the best explanation for the increase in commuting time from Holdsville to River Valley?,['for']
"Which of the following principles, if valid, best justifies Olga's position?",['if']
"Which of the following, if true, most helps to explain why not all office buildings designed to prevent outside air from entering have air that contains elevated levels of toxic substances?",['if']
"The environmentalist's statements, if true, most strongly support which one of the following?",['if']
"Which one of the following, if true, would most strengthen the essayist's argument?","['if', 'if then']"
The occultist's argument is most vulnerable to criticism on the grounds that it takes for granted that,['for']
"Which of the following, if discovered to be true, most seriously undermines the hypothesis?",['if']
"If all of Reza's statements are true, then which one of the following must also be true?",['if']
The conclusion above would be most undermined if it were true that,['if']
"Which one of the following, if true, most strongly supports the statement above?",['if']
"Which one of the following, if true, most supports the columnist's argument?",['if']
Chiu's conclusion follows logically if which one of the following is assumed?,['if']
"Which of the following would, if true, most strongly support the prediction that the plan would achieve its goal?",['if']
"Which one of the following, if true, could contribute most to a refutation of the argument?",['if']
"If salaries have kept pace with rising prices during the past year, which one of the following must be true?",['if']
The statement that Bloodhounds have been trained to not attack rabbits or squirrels plays which of the following roles in Melanie's argument?,['or']
"Which one of the following, if assumed, enables the psychologist's conclusion to be properly drawn?",['if']
"Each of the following, if true, provides support to the argument EXCEPT:",['if']
"If the facts stated in the passage above are true, a proper test of a country's ability to be competitive is its ability to",['if']
"Which of the following, if true, most seriously challenges the mayor's argument?",['if']
"Which of the following, if true, provides the strongest justification for the farmers' reluctance?","['if', 'for']"
"Which one of the following, if true, most helps to resolve the apparent discrepancy described by the statements above?",['if']
"Which one of the following, if true, contributes most to an explanation of why bridges fracture elsewhere than at high-stress points?",['if']
"Which one of the following would, if true, most weaken the psychologist's argument?",['if']
"Which of the following, if true, most strongly supports the prediction that the finance minister's plan will not result in a significant increase in Argonia's exports next year?","['if', 'next']"
"Which one of the following, if true, most helps to explain how both reports could be accurate?",['if']
Peter and Yoko disagree over whether today's children's stories,['and']
"Which one of the following principles, if valid, most helps to justify the conservationist's reasoning?",['if']
"Which of the following would, if found in the excavation, most likely help reveal the pattern of the official's administrative service?",['if']
"Which one of the following principles, if established, provides the strongest justification for the department chair's refusal, on the ground she gives, to sign the protest letter?","['if', 'for']"
The conclusion drawn in the argument above follows logically if which one of the following is assumed?,['if']
"Which one of the following, if true, most strengthens the essayist's argument?","['if', 'if then']"
Which one of the following is a point at issue between Dr. Lopez and Dr. Tseung?,['and']
"Which one of the following, if true, most strengthens the argument above?","['if', 'if then']"
"Which one of the following, if true, most helps to explain the biologists' findings?",['if']
"Which of the following, if true, most seriously undermines the researchers' reasoning?",['if']
"Which of the following, if true, suggests that Mayor Bloomfield's plan will be successful?",['if']
"Which of the following, if true, provides the strongest justification for the experts' prediction?","['if', 'for']"
"Which of the following, if true, undermines the argument above?",['if']
The conclusion of the argument is most strongly supported if which one of the following completes the passage?,['if']
"If the statements above are true, which one of the following can be properly inferred?",['if']
"Which one of the following principles, if valid, most helps to justify the political theorist's argument?",['if']
"The principle that Michiko invokes, if established, would justify which one of the following judgments?",['if']
"Which one of the following most accurately describes the role played in the critic's argument by the claim that when we evaluate a work principally for its themes and ideas, we cut ourselves off from the work's emotional impact?","['and', 'for']"
"Which one of the following, if true, lends the most support to the psychologist's conclusion?",['if']
"If the statements above are true, which of the following conclusions is most strongly supported by them?",['if']
For which one of the following reasons can the test described above never provide conclusive proof of the authorship of any poem?,['for']
"If the statements above are true, which of the following must also be true?",['if']
"Which of the following, if true, would provide the mayor with the strongest counter to the birdwatcher's objection?",['if']
The reasoning above is most susceptible to criticism because the author,['because']
"Which one of the following principles, if accepted, would provide the most justification for the conclusion?","['if', 'for']"
"Which one of the following principles, if valid, would most help to justify Mike's reasoning?",['if']
"Each of the following, if true, would call into question the friend's conclusion EXCEPT:",['if']
The reference to the complaint of several centuries ago that powerful memory and extemporaneous eloquence were being destroyed plays which one of the following roles in the argument?,['and']
"If the information above is accurate, a liver cell in which more than 60 divisions took place in a tissue culture CANNOT be which one of the following?",['if']
"Which one of the following, if true, most strengthens the anthropologist's argument?","['if', 'if then']"
"Each of the following, if true, provides support for the clothing manufacturers' expectations EXCEPT:","['if', 'for']"
"Each of the following, if true, helps to explain the findings of the study cited by the sociologist EXCEPT:",['if']
The dialogue provides the most support for the claim that Carrillo and Olson disagree over whether,"['and', 'for']"
Megan and Channen disagree over whether,['and']
Which one of the following statements is most strongly supported by the exchange between David and Lin?,['and']
"Which of the following, if true, would most weaken the argument above?",['if']
The argument is most vulnerable to criticism because it,['because']
The censorship advocate's rebuttal is flawed because it,['because']
"The information above best supports which of the following hypotheses about people with the disorder described, if they have no other serious visual problems?",['if']
Which of the following must be true if the manufacturer's prediction is to prove accurate?,['if']
"Which one of the following, if true, is the logically strongest counter that Albert can make to Erin's argument?",['if']
"Which one of the following, if true, most helps to explain the researchers' finding?",['if']
"Which one of the following, if true, most helps to explain Professor Popkin's instructions to her travel agent regarding the grouping of her flights into round-trips?",['if']
"Which one of the following, if true, most substantially weakens the argument?",['if']
"Which one of the following, if assumed, would most help to justify treating the human feeding of wild birds as an exception to the principle above?","['if', 'as']"
"Each of the following, if true, helps to explain the statistical relationship described above EXCEPT:",['if']
"Which of the following, if true, would most strongly support the position above?",['if']
"Which one of the following, if true, most supports the environmentalists' proposal?",['if']
"On the basis of their statements, Hendry and Menkin are committed to disagreeing over whether",['and']
"Which of the following, if true, would help resolve the apparent paradox presented above?",['if']
"If the information presented is true, which of the following can most reliably be concluded on the basis of it?",['if']
"Which of the following, if true, most seriously undermines this reasoning?",['if']
"Which of the following most logically completes the argument? In a typical year, Innovair's airplanes are involved in 35 collisions while parked or being towed in airports, with a resulting yearly cost of $1, 000, 000 for repairs.","['or', 'for']"
"Which of the following, if true, is most damaging to the position of the cable-television spokesperson?",['if']
The claim that the penalties for drunk driving are far more severe when the drunk driver accidentally injures people than when no one is injured plays which one of the following roles in the ethicist's argument?,['for']
"Which one of the following, if true, resolves the apparent discrepancy noted above?",['if']
"If the information above is true, which one of the following must also be true?",['if']
"Which one of the following, if true, most helps explain how newborn dunnarts manage to survive despite their thin skins?",['if']
"Which one of the following would, if true, most weaken the researchers'conclusion?",['if']
The philosopher's conclusion follows logically if which one of the following is assumed?,['if']
"Which one of the following, if true, would most strengthen the zoologist's argument?","['if', 'if then']"
"If the professor's statements are true, which one of the following must also be true?",['if']
Which one of the following most accurately states the overall conclusion drawn in the economist's argument?,['overall']
The conclusion of the astrophysicist's argument is most strongly supported if which one of the following is assumed?,['if']
"The designer's statements, if true, most strongly support which one of the following?",['if']
"Each of the following, if true, could by itself constitute an explanation of the outcome of the photography contest EXCEPT:",['if']
The advertising claim is misleading in its selection of information on which to focus if which one of the following is true?,['if']
The considerations above can best serve as part of an argument that,['as']
"The statements above, if true, serve LEAST well as evidence for which one of the following?","['if', 'as', 'for']"
"Which one of the following, if true, does most to resolve the apparent discrepancy in the information above?",['if']
"Which one of the following, if true, most helps to resolve the apparent conflict between Shelton's and Russo's statements?","['if', 'and']"
The reasoning in the philosopher's argument is flawed because the argument,['because']
"Which one of the following, if true, would count as evidence against the scientist's explanation of Earth's warming?","['if', 'as']"
"Which one of the following principles, if established, would justify the judgments about George's and Carla's actions?","['if', 'and']"
"Which one of the following, if true about the newspaper in 1992, most seriously undermines the justification offered by the executive?",['if']
The main conclusion of the literary critic's argument can be properly inferred if which one of the following is assumed?,['if']
"Which of the following, if true, would most seriously weaken the conclusion about how to prevent future currency declines?",['if']
"Which one of the following, if true, most seriously undermines the company spokesperson's argument?",['if']
The editors' dialogue provides the most support for the claim that they disagree with each other about whether,['for']
"Which of the following, if true, best helps to account for the inconsistency noted above?","['if', 'for']"
"Which of the following, if true, most logically completes the passage?",['if']
"Which of the following would, if true, most logically help explain why the watersupply companies are asking the authorities to regulate residential water use?",['if']
The editorial's conclusion follows logically if which one of the following is assumed?,['if']
"The statements above, if true, most strongly support which one of the following conclusions about the last ice age and its aftermath in North America?","['if', 'and']"
"Each of the following, if true, helps to explain the result of the study cited above EXCEPT:",['if']
"If the information above is true, and if the researchers' investigation was properly conducted, then which of the following must also be true?","['if', 'and', 'if then']"
Which one of the following contains the same logical flaw as that in the passage above?,['as']
"Which of the following, if true, most seriously calls into question the explanation given for the thrush's diet during migration?","['if', 'for']"
"Which one of the following statements, if true, best supports the sociologist's argument?",['if']
"Which one of the following, if true, most seriously weakens the company president's argument?",['if']
The reason given for the structure of the Security Council assumes that,['for']
"Which one of the following principles, if established, does most to justify the position advanced by the passage?",['if']
Which of the following is required for the revamped collection program to achieve its aim?,['for']
"Which one of the following, if true, would most help to resolve the dispute described above in favor of one party to it?",['if']
"Which of the following, if true, could best be used by the environmentalist to counter the business spokesperson's argument?",['if']
"In deciding whether the feed would be useful in raising salmonella-free chicken for retail sale, it would be most helpful to determine which of the following?",['for']
"Which one of the following, if true, most strengthens Fisch's argument?","['if', 'if then']"
"Which of the following statements, if true, provides additional support for the argument?","['if', 'for']"
The conclusion of the psychiatrist's argument is most strongly supported if which one of the following completes the argument?,['if']
"Which one of the following generalizations, if applicable to Sarah's company, most helps to justify her reasoning?",['if']
"Which of the following, if true, would provide a basis for explaining the fact that Sammy's aunt and Pats brother had contrasting experiences with the same diet?","['if', 'and', 'for']"
"Which one of the following, if true, most seriously weakens the dealer's arguments?",['if']
"Which of the following statements, if true, would most weaken the argument presented above?",['if']
"In light of the further information, which of the following, if true, does most to explain the result that followed implementation of the plan?","['if', 'further']"
Which of the following must be assumed in order for the conclusion of the argument above to be properly drawn?,['for']
"The environmentalist's statements, if true, most strongly support which one of the following inferences?",['if']
The information above provides the LEAST support for which one of the following?,['for']
"Which of the following, if true, most strongly suggests that stricter sanctions against hunting would not have the desired effect?",['if']
"Which one of the following, if true, would most weaken the archaeologist's argument?",['if']
"Which of the following, if true, most logically completes the argument below?",['if']
"Which of the following, if true, argues most strongly against concluding, on the basis of the information above, that the oceanographers' hypothesis is false?",['if']
"Which of the following, if true, casts the most doubt on whether the measure enacted by the council will achieve its goal?",['if']
"Which one of the following, if true, most helps to explain why raisins contain more iron per calorie than do grapes?",['if']
"Which one of the following, if assumed, would allow the conclusion to be properly drawn?",['if']
"Which one of the following principles, if valid, most strongly supports the reasoning in the argument?",['if']
"Which one of the following, if true, most helps to resolve the paradox?",['if']
"Which one of the following, if true, most seriously undermines the argument's stated conclusion?",['if']
Council members P and Q disagree over whether,['and']
"Which of the following, if true, most fundamentally calls into question the aviation analyst's argument?",['if']
The main conclusion above follows logically if which one of the following is assumed?,['if']
"Which one of the following, if true, most helps to support the film director's explanation?",['if']
"Which of the following statements, if true, most seriously weakens the argument above?",['if']
"Which one of the following, if true, most helps to explain the discrepancy described above?",['if']
"Which one of the following, if true, would most help to justify the physician's argumentation?",['if']
William's argument against Anna's claims about rainbows is most vulnerable to criticism because it,['because']
"Which one of the following principles, if valid, most helps to justify the judgment that dismissing the complaint would be unfair?",['if']
"Why should what has worked in the past be changed now? Which one of the following, if true, is the most effective counter Pamela might make to Quincy's argument?",['if']
"If the statements in the passage are true, which one of the following must also be true about Kay's course of action in any election to select one candidate for a position?","['if', 'for']"
"Which of the following, if true, would it be most important to take into account in evaluating the result?",['if']
"Which of the following, if true, provides the strongest grounds for a prediction that municipalities will buy QuickFreeze's purification system despite the need to maintain a conventional purification system as well?","['if', 'as', 'for']"
The dialogue provides the most support for the claim that Gwin and Chambal disagree over which of the following?,"['and', 'for']"
"Which one of the following, if true, most seriously weakens the advertisement's argument?",['if']
The view that children should never be reprimanded functions in the psychologist's argument as a statement of a position that the psychologist's argument,['as']
The claim that a choice of diet can affect whether or not one has a heart attack plays which one of the following roles in the argument?,['or']
"If the statements above are true, which one of the following must be true?",['if']
"Which of the following, if true, most helps to resolve the apparent discrepancy above?",['if']
Which one of the following is a point at issue between Muriel and John?,['and']
"If all of the statements above are true, then which one of the following CANNOT be true?",['if']
Laurel's and Miriam's statements provide the most support for the claim that they disagree about whether,"['and', 'for']"
"Each of the following, if true, could help to resolve the apparent discrepancy described above EXCEPT:",['if']
"Which one of the following principles, if valid, would most help to justify the political scientist's reasoning?",['if']
"Which one of the following, if true, most strengthens the economist's argument?","['if', 'if then']"
"The statements above, if true, provide the most support for which one of the following claims?","['if', 'for']"
"Which one of the following, if true, is the strongest logical counter parent P can make to parent Q's objection?",['if']
"Which one of the following, if true, helps explain the information presented above?",['if']
"Which one of the following, if true, most helps to resolve the apparent discrepancy between the two reports?",['if']
"Which of the following, if true, best supports the claim above?",['if']
"Which of the following, if true, most clearly points to a flaw in the manufacturer's plan to repeat the successful performance of the summer quarter?",['if']
"Which one of the following, if assumed, enables the essayist's conclusion to be properly drawn?",['if']
"Which of the following, if true, most helps to explain the urban planning consultants' position?",['if']
"Each of the following, if true, strengthens the scientist's argument EXCEPT:","['if', 'if then']"
"The statements above, if true, most strongly support which one of the following views?",['if']
"Which one of the following, if assumed, enables the conclusion of the city councilperson's argument to be properly inferred?",['if']
"Which one of the following, if true, most undermines the conclusion above?",['if']
Which one of the following most accurately states the conclusion of the argument as a whole?,['as']
"Which one of the following, if true, most helps to explain why some people are willing to invest in new technologies that promise to extend life and decrease pain?","['if', 'and']"
"Which of the following, if true, most helps to explain the proliferation of steam-powered factories during the earliest period of industrialization in Britain?",['if']
The statements above provide the most support for which one of the following inferences?,['for']
Which of the following would it be most useful for Centennial Commercial to know in evaluating the plan it is considering?,['for']
"If the statements above are true, which one of the following CANNOT be true?",['if']
Michele and Alvaro disagree with each other about which one of the following?,['and']
The statements above provide the most support for which one of the following?,['for']
"If the scientist's claims are true, which one of the following must also be true?",['if']
"Which of the following, if true, provides the most support for the argument above?","['if', 'for']"
Which one of the following is an assumption necessary for the critic's conclusion to be properly drawn?,['for']
Which one of the following is an assumption upon which the author's conclusion concerning helmets for horseback riders depends?,['for']
"Which of the following, if true, tends to confirm the conclusion above?",['if']
"Which of the following, if true, most weakens the editorial's argument?",['if']
"Which one of the following, if true of Centerburgh, most justifies the above application of the principle?",['if']
"Each of the following, if true, provides additional support for the researchers' hypothesis EXCEPT:","['if', 'for']"
The candy manufacturer's response is flawed as a refutation of the consumer health advocate's argument because it,"['because', 'as']"
The dialogue provides the most support for the claim that Annette and Sefu disagree over whether,"['and', 'for']"
"As a reply to Dr. Kim's argument, Dr. Anders' response is inadequate because it","['because', 'as']"
"Which one of the following, if true, provides the strongest support for the market researchers' claim?","['if', 'for']"
"Which one of the following, if true, most helps to explain the decrease in travel times described above?",['if']
"If the statements above are true, they provide the most support for which one of the following?","['if', 'for']"
"Which one of the following principles, if valid, most helps to justify the reasoning in the advice columnist's argument?",['if']
The conclusion of the commentator's argument follows logically if which one of the following is assumed?,['if']
The reasoning in the advocate's argument is flawed because the argument,['because']
"Which one of the following, if assumed, most helps to justify the reasoning in the archaeologist's argument?",['if']
"Which one of the following, if true, most strongly supports the prediction made by the market analysts?",['if']
