sentence,keyword
"Sonya's statements, if true, most strongly support which one of the following?",['if']
"Which one of the following, if assumed, enables the argument's conclusion to be properly drawn?",['if']
The educators' reasoning provides grounds for accepting which one of the following statements?,['for']
"If all of the mayor's statements are true, then which one of the following must also be true?",['if']
The dialogue provides the most support for the claim that Rhett and Barbara disagree over whether,"['and', 'for']"
The conclusion follows logically if which one of the following is added to the premises?,['if']
"Which of the following, if true, casts the most doubt on the author's conclusion?",['if']
"Which of the following plans, if feasible, would allow a company to prepare most effectively for the rapid obsolescence of skills described above?","['if', 'for']"
Raphaela and Edward disagree about the truth of which one of the following?,['and']
"The statements above, if true, provide a basis for rejecting which one of the following claims?","['if', 'for']"
"Which of the following, if true, most strongly supports the network's position?",['if']
"If the voters' reactions are guided by a principle, which one of the following principles would best account for the contrast in reactions described above?","['if', 'for']"
"Which one of the following, if true, most strengthens the nutritionist's conclusion?","['if', 'if then']"
"Which of the following, if true, most strongly supports the conclusion that the use of Streptanthus to extract nickel will be commercially adopted?",['if']
"Which one of the following, if true, most helps to explain why the agricultural peoples of western Asia never returned to hunting and gathering?","['if', 'and']"
The conclusion is incorrectly drawn from the information given because this information does not include,['because']
"Which one of the following, if true, does most to explain the apparent counterexample described above?",['if']
"If all of the statements in the passage are true, each of the following must also be true EXCEPT:",['if']
"Which of the following, if true, would explain the apparent paradox?",['if']
Which one of the following principles provides the most appropriate completion for the argument?,['for']
The conclusion of the editorialist's argument can be properly drawn if which one of the following is assumed?,['if']
"Which one of the following, if assumed, would do most to justify the claim that the price of halibut will increase?",['if']
The conclusion of the reviewer 's argument can be properly drawn if which one of the following is assumed?,['if']
"Which of the following, if true about Britain, most seriously weakens the argument?",['if']
"Which one of the following, if true, most seriously weakens the sociologist's argument?",['if']
The dialogue most strongly supports the claim that Winston and Sanjay agree that,['and']
The economist's reasoning is flawed because the economist takes for granted that,"['because', 'for']"
"Which of the following, if true, would provide the strongest support for the position held by industry officials?","['if', 'for']"
"Each of the following, if true, would weaken the columnist's argument EXCEPT:",['if']
The conclusion above is unwarranted because,['because']
The statement that contamination of lakes and rivers from pollutants in rainwater runoff exceeds that from industrial discharge plays which one of the following roles in the argument?,['and']
"Which one of the following principles, if established, helps most to justify Scott's evaluation of the psychiatrist's actions?",['if']
"Which of the following would, if true, most help to explain the strategy of the plant breeders referred to above?",['if']
"Which one of the following, if true, adds the most support for the archaeologist's hypothesis?","['if', 'for']"
"Which of the following, if true, would, together with the information above, provide the best basis for the claim that the charred bone fragments are evidence of the use of fire by early hominids?","['if', 'for']"
"Which one of the following, if true, most helps to explain the increased likelihood that an unemployed retiree will have a heart attack on a Monday?",['if']
Which one of the following most accurately expresses the role played in the argument by the claim that television is so important politically and culturally?,['and']
"Which of the following, if true, most helps explain why there is no need for lizards to guard their tunnels for more than a few days?","['if', 'for']"
"Which one of the following, if true, provides the strongest support for the explanation?","['if', 'for']"
"Which one of the following principles, if valid, most helps to justify the ethicist's claims?",['if']
"Which of the following, if true, most logically complete the argument?",['if']
"The principle invoked by the credit card companies would, if established, be most usefully invoked in which one of the following arguments?",['if']
"Which of the following, if true, casts the most doubt on the doctor's conclusion?",['if']
"Each of the following, if true, weakens the resident's argument EXCEPT:",['if']
The ethicist's conclusion follows logically if which one of the following is assumed?,['if']
"As applied to the act of translating poetry from one language into another, the analogy above can best be understood as saying that",['as']
"Which one of the following principles, if valid, most helps to justify the bookstore owner's argumentation?",['if']
Annie and Matilda disagree about whether,['and']
"Which one of the following, if true, most seriously weakens the researchers' argument?",['if']
The reasoning above is most vulnerable to criticism because it,['because']
"Which of the following, if true, casts the most serious doubt on the adequacy of the Arundian politicians' justification for the proposed legislation?","['if', 'for']"
"Which of the following, if true, most weakens the dentists' claims?",['if']
"If the claim made by people opposed to the new legislation is true, which one of the following is a principle that, if established, would do the most to justify opposition to the new legislation on the basis of that claim?",['if']
The conclusion can be properly drawn if which one of the following is assumed?,['if']
"Which of the following, if true during the last three years, contributes most to a resolution of the apparent discrepancy above?",['if']
"Which one of the following, if true, most helps to reconcile the apparent conflict described above?",['if']
"Which of the following, if true, casts the most serious doubt on the course of action recommended for parents?","['if', 'for']"
"Which one of the following, if true, most strengthens the researchers' reasoning?","['if', 'if then']"
"This may not be a narrative, but what medically trained specialist can deny the existence of that myth? Which one of the following most accurately characterizes Giselle's response to Joel's statement?",['but']
The argument's conclusion follows logically from its premises if which one of the following is assumed?,['if']
"Which of the following, if true, most strongly supports the argument?",['if']
"Which of the following, if true, most seriously calls into question the plan's chances for success?","['if', 'for']"
"If both G's assertions and H's assertion are true, which one of the following must also be true?","['if', 'and']"
"In determining the impact on company profits of using potassium chloride in place of common salt, it would be important for Tanco to research all of the following EXCEPT:",['for']
"Which of the following, if true, best explains the situation described above?",['if']
"Which one of the following statements, if true, would most strengthen the argument?","['if', 'if then']"
"Which one of the following, if true, most seriously weakens the reasoning above?",['if']
"Which of the following, if true, helps LEAST to resolve the apparent discrepancy noted above?",['if']
"Which one of the following, if true, most weakens the commentator's argument?",['if']
"Which of the following, if true, provides the strongest support for the manufacturer's position?","['if', 'for']"
"Which one of the following, if true, could contribute most to explaining the discrepancy between the reported percentages?",['if']
"Science Academy study: It has been demonstrated that with natural methods, some well-managed farms are able to reduce the amounts of synthetic fertilizer and pesticide and also of antibiotics they use without necessarily decreasing yields; in some cases yields can be increased.",['and']
"Which of the following, if true about the United States between 1995 and 2000, most helps to explain why the fatality rate decreased in spite of the increase in average highway speeds?","['if', 'and']"
"Which of the following, if true in Verland, most seriously undermines the force of the evidence cited?",['if']
The conclusion above is properly drawn if which of the following is assumed?,['if']
"Which of the following is an assumption that, if true, would allow the conclusion above to be properly drawn?",['if']
"Which one of the following, if true, most weakens the educator's argument?",['if']
"Which one of the following, if true, most seriously undermines the conclusion drawn in the argument above?",['if']
"Which one of the following, if true, most helps to account for the response of auto safety experts to the popularity of SUVs?","['if', 'for']"
"The environmentalist's statements, if true, best support which of the following as a conclusion?","['if', 'as']"
"Each of the following, if true, supports the zoologist's reasoning EXCEPT:",['if']
The answer to which of the following would be most useful for evaluating the community activist's reasoning?,['for']
"Each of the following, if true, contributes to an explanation of the skewed distribution of lamps EXCEPT:",['if']
"Based on the text above, which of the following can be assumed about Carol and Kenny's investment strategies?",['and']
"Which of the following would, if true, most strongly suggest that the plan, if implemented, would increase the overall efficiency of PhishCo's farms?","['if', 'overall']"
The conclusion of the salesperson's argument is most strongly supported if which one of the following is assumed?,['if']
The point at issue between Aaron and Belinda is whether,['and']
"Which of the following would, if true, most help to explain the strategy of True Clothing referred to above?",['if']
"Which of the following, if true, helps to explain the Yorgorian Paradox?",['if']
"Which one of the following, if true, would most strengthen the reasoning in the argument?","['if', 'if then']"
"Which of the following, if true, would best support the anthropologists' conclusion?",['if']
"Which one of the following, if true, most helps to explain how both of the claims made above could be true?",['if']
"Which of the following, if true of Berinia, most helps to resolve the apparent discrepancy?",['if']
"&gt; Which of the following, if true, will most seriously weaken the conclusion drawn above?",['if']
"Which one of the following, if true about East Wendell, shows that the explanation above is at best incomplete?",['if']
"Which of the following, if true, casts most doubt on the conclusion of the argument?",['if']
"If the statements above are true, which one of the following must also be true on the basis of them?",['if']
"Which one of the following, if true, most seriously undermines the conclusion drawn from the new evidence?",['if']
Alia and Martha disagree on whether,['and']
"Which one of the following principles, if accepted, would contribute most to Shanna's defense of her position against that of Jorge?",['if']
"Which one of the following, if true, most weakens the science columnist's explanation for the claim that humans have so many diseases in common with cats?","['if', 'for']"
"Each of the following, if true, strengthens the doctor's argument EXCEPT:","['if', 'if then']"
"Which of the following, if true, most strongly supports the hypothesis that Codex Berinensis was produced in 1148?",['if']
"Which one of the following, if true, most helps to justify the company president's criticism of the human resources department's proposal?",['if']
"If all of the statements in the passage are true, which one of the following must also be true?",['if']
Goswmi and Nordecki disagree over the truth of which one of the following statements?,['and']
"Which of the following, if true, would most seriously weaken the archaeologist's argument?",['if']
"Which of the following would, if true, most strengthen the likelihood that the manager's plan will achieve its goal?","['if', 'if then']"
The conclusion of the argument can be properly drawn if which one of the following is assumed?,['if']
"Which of the following, if true, most seriously weakens the researcher's conclusion?",['if']
"Each of the following, if true, weakens the argument above EXCEPT:",['if']
"Which one of the following, if true, most seriously casts doubt on the wisdom of this recommendation?",['if']
"If the claims above are true, which one of the following must, on the basis of them, be true?",['if']
"Which one of the following statements, if true, most seriously weakens the commentator's argument?",['if']
The reasoning is questionable because it ignores the possibility that,['because']
"Which one of the following, if true, provides the most additional support for the argument?","['if', 'for']"
"Which of the following, if true, most helps to explain the disproportionate increase in customer complaints?",['if']
"Which one of the following, if true, would most weaken the conclusion above?",['if']
"Which of the following, if true, provides the most effective support for the argument?","['if', 'for']"
Which one of the following is the main point at issue between the hospital auditor and the clinic administrator?,['and']
"The statements above, if true, most strongly support which conclusion?",['if']
"The proposal above, once put into effect, would be most likely to result in continued scheduling conflicts for which one of the following groups?","['once', 'for']"
"Which one of the following, if true, would weaken the argument?",['if']
"Which of the following, if true, would most weaken the conclusion drawn above?",['if']
Victor's response does not succeed as a rebuttal of Lenore's argument because his response,"['because', 'as']"
"Which one of the following, if true, would most strengthen the researchers' reasoning?","['if', 'if then']"
"Each of the following, if true, helps to resolve the apparent paradox above EXCEPT:",['if']
The point at issue between the motorcoach driver and the police officer is whether,['and']
"If the statements above are true, which one of the following claims is most strongly supported by them?",['if']
That a migration from Africa and the Middle East to China occurred at least one million years ago figures in the above reasoning in which one of the following ways?,['and']
"Which one of the following, if true, most seriously undermines the argument's reasoning?",['if']
"Each of the following, if true, contributes to a resolution of the apparent discrepancy described above EXCEPT:",['if']
"Which one of the following, if true, best reconciles the discrepancy described above?",['if']
"If the statements above are true, each of the following could be true EXCEPT:",['if']
The attorney's argument is fallacious because it reasons that,['because']
In which one of the following instances does the extract from the lease most strongly support the view that the tenant is not required to pay for the damage?,['for']
"The critic's statements, if true, most strongly support which one of the following?",['if']
"Which one of the following, if true, most strongly supports the argument?",['if']
The argument is flawed because it overlooks each of the following possibilities EXCEPT:,['because']
"Which of the following , if true casts the most serious doubt on the rail executive's argument?",['if']
"Which of the following, if true, provides the most support for the conclusion?","['if', 'for']"
"If the statements above are true, which one of the following is most strongly supported by them?",['if']
"Which one of the following, if true, would most help to resolve the puzzle described above?",['if']
The reasoning is flawed because it,['because']
"Which one of the following, if true, does most to account for the increase in the rate of population decline described above?","['if', 'for']"
"Which one of the following, if true, does most to explain why the estimates remain virtually unchanged?",['if']
"Each of the following, if true, would strengthen the consumer advocate's argument EXCEPT:","['if', 'if then']"
"Which one of the following principles, if valid, most helps to justify the lawyer's analysis?",['if']
"Which of the following, if true, most helps to explain why the time spent washing clothes increased in rural areas?",['if']
"The statements above, if true, provide support for each of the following EXCEPT:","['if', 'for']"
"Which of the following, if true, most strongly supports the pharmaceutical industry's argument against the challenge made above?",['if']
"Which one of the following arguments, if true, most strengthens the geologist's argumentation?","['if', 'if then']"
"Which of the following, if true, most helps to explain the surprising finding?",['if']
"If the statements above are true, which of the following must also be true on the basis of them?",['if']
"Which of the following statements, if true, would support the criticism of the Industry Analyst?",['if']
The reasoning is flawed because the argument,['because']
The dialogue provides most support for the claim that the student and the professor disagree over whether,"['and', 'for']"
"Which one of the following, if true, would constitute the strongest objection to the executive's argument?",['if']
Which one of the following most accurately expresses the point at issue between Efraim and Felicity?,['and']
"Which one of the following, if assumed, most helps to justify the application of the principle?",['if']
Which one of the following most accurately describes the role played in the argument by the claim that a band signed with a major label does not need to assume nearly as much risk as it would if it produced its own records independently?,"['if', 'as']"
"Which of the following, if true, calls into question the conservationist's prediction?",['if']
The reasoning in newspaper company X's president's argument is flawed because the argument,['because']
Which one of the following most accurately expresses the overall conclusion drawn in Brianna's argument?,['overall']
"Which one of the following, if true, would most strengthen the researcher's argument?","['if', 'if then']"
"Which of the following, if true, would provide the strongest grounds for the public health officials' reluctance?","['if', 'for']"
"If the sales figures cited by the accountant and the sales manager are both accurate, which one of the following must be true?","['if', 'and']"
"Which one of the following, if true, justifies the above application of the policy?",['if']
"If the information above is correct, which of the following conclusions can properly be drawn on the basis of it?",['if']
"If the information above is correct, which one of the following conclusions can be properly drawn on the basis of it?",['if']
"Which one of the following statements, if true, most weakens the critic's argument?",['if']
"The forester's statements, if true, most strongly support which one of the following?",['if']
"Which of the following, if true, most helps to explain the disproportionate increase in traffic fatalities?",['if']
"Which one of the following principles, if established, would justify the proposal put forth by Walter?",['if']
"The medical school professor's statements, if true, most strongly support which one of the following?",['if']
"Which one of the following, if true, most helps to reconcile the safety experts' belief with the apparently contrary evidence described above?",['if']
"Each of the following, if true, contributes to an explanation of the difference in marathon performances described above EXCEPT:",['if']
"Which one of the following, if true, most helps to explain the surprising fact?",['if']
"Which of the following, if known, would be most relevant to evaluating the claim above about how new coal-burning plants could save money?",['if']
The analysis provided for this situation is most similar to which of the following situations?,['for']
"Which one of the following, if true, would most weaken the argument?",['if']
The reasoning in the argument is weak because the argument,['because']
"Which one of the following, if true, provides the most support for the meteorologist's argument?","['if', 'for']"
"The economist's statements, if true, most strongly support which one of the following?",['if']
The argument's reasoning is questionable because the argument,['because']
"If the statements in the passage are true, then which one of the following must also be true?",['if']
"Which one of the following, if true, would most weaken the ethicist's argument?",['if']
"Which one of the following, if true, most seriously weakens the representative's implied argument that the public need not be concerned about the leak?",['if']
"Which one of the following, if true, most strengthens the support for the scientists' hypothesis?","['if', 'for', 'if then']"
Which one of the following is an assumption that the argument requires in order for its conclusion to be properly drawn?,['for']
"If the statements above are true, then each of the following could be true EXCEPT:",['if']
The reasoning in the consumer advocate's argument is flawed because this argument,['because']
Which of the following hypotheses best accounts for the findings of the experiment?,['for']
"Which of the following, if true, most seriously undermines the argument offered in refutation of the environmentalists' prediction?",['if']
"Which of the following, if true, most strongly weakens the editorial's argument?",['if']
"Which one of the following, if true, adds the most support to the argument?",['if']
Which one of the following most accurately describes the role played in the astrologer's argument by the statement that scientific studies cannot be used to disprove a correlation between personality type and any other phenomenon?,['and']
"Each of the following, if true, helps to resolve the apparent discrepancy above EXCEPT:",['if']
"That claim is false, however, since according to Moviemania's own sales figures, Moviemania sold 5 percent more popcorn last year than in the previous year. <br>Which of the following, if true, most strongly supports the argument against Moviemania's claim?",['if']
"Which one of the following, if true, most strengthens the safety consultant's argument?","['if', 'if then']"
"Which of the following, if true, would best support the conclusion that some ingredient of the sweetener was responsible for the experimental results?","['if', 'for']"
"Which of the following, if true, most strongly supports the restorers' hypothesis?",['if']
"Which one of the following, if true, most helps to explain why trees of the rarest species tend to survive longer than trees of the most common species?",['if']
"The principle above, if valid, most strongly supports which one of the following arguments?",['if']
"Which one of the following, if true, most helps to explain why the astronomer's estimates of the stars' distances from Earth help resolve the earlier conflict between the ages of these stars and the age of the universe?","['if', 'earlier', 'and']"
"Which of the following, if true, most helps to explain the apparent discrepancy?",['if']
"If all the statements above are true, which of the following must also be true?",['if']
"If the statements above are true, which one of the following, if also true, would most strongly support the conclusion that the fragile hind limbs are remnants of limbs that land-dwelling whales once had?","['once', 'if']"
Which one of the following is most strongly supported if all of the statements above are true?,['if']
Franklin's and Tomeka's statements provide the most support for holding that they disagree about the truth of which one of the following?,"['and', 'for']"
The conclusion cited above does not follow unless,['unless']
"Which one of the following, if true, most calls into question the researchers' conclusion?",['if']
"Which of the following, if true, provides the best basis for a rebuttal of the criticism?","['if', 'for']"
"Which of the following, if true, most helps to explain the decline in the incidence of pellagra?",['if']
The art critic's reasoning is most vulnerable to the criticism that it takes for granted that,['for']
Which one of the following correctly describes both an error in Terry's reasoning and an error in Pat's reasoning?,['and']
"Which one of the following, if true, most strengthens the columnist's reasoning?","['if', 'if then']"
"The Professor's statements, if true, most support which one of the following?",['if']
"If the critic's statements are true, each of the following could be true EXCEPT:",['if']
"Which one of the following, if true, most helps to explain the unexpected result described above?",['if']
"Which of the following, if true, provides the strongest support for the hypothesis that trace impurities in the iron are essential for the production of Damascus blades?","['if', 'for']"
"Which one of the following, if true, most weakens the economist's argument?",['if']
"Which one of the following, if true, does most to justify the apparently contradictory conclusion above?",['if']
